Food,Price,Category,Desc
Badam Kheer,79,Desserts & Juices,"Creamy rich and delicious keer with skimmed milk, rice, sweetened with jaggery and topped with roasted almonds.
[Skim Milk, Rice, Jaggery, Roasted Almonds]

Allergen information: Dairy, nutsless"
Seviya Kheer,99,Desserts & Juices,"Delectable and homely sevaiyan kheer-  sweetened with jaggery, can be a perfect energy booster and a mood uplifter for an anytime, anyday craving!

Allergen Information- Contains Dairy & Nutsless"
Mango Pudding,139,Desserts & Juices,"A delightful mango dessert made with ripe mango pulp, broken wheat, coconut milk and topped with nuts and pomegranate seeds. Perfect summery treat! 

Allergen Information- Contains Dairy, Gluten and Nutsless"
Chocolate Nutty Dates Pudding,99,Desserts & Juices,"Be ready to go nuts over this delectable combination of chocolate, nuts and dates pudding with the chewy base of broken wheat.
[Skim Milk, Dark Chocolate, Coconut Milk, Jaggery]

Allergen information: Contains Gluten, Dairy & Nuts.less"
Panjiri Laddu (500g),399,Desserts & Juices,"An Indian delight that combines whole wheat flour, desi cow ghee, nuts, and khand (zero white sugar used), rolled into laddoos—a nutritious and energy-packed treat.

Allergen Information- Contains Gluten, Dairy & Nutsless"
Badam Kheer (400gm),153,Desserts & Juices,"Creamy rich and delicious keer with skimmed milk, rice, sweetened with jaggery and topped with roasted almonds.
[Skim Milk, Rice, Jaggery, Roasted Almonds]

Allergen information: Dairy, nutsless"
Gajar Ka Halwa,169,Desserts & Juices,"Quintessential Indian dessert made with carrots, milk, khoya, khandasari sugar, ghee and cardamom. It's rich, creamy and so decadent!

 Allergen information: Contains Dairy, Nutsless"
Guilt Free Plum Cake (200gm),287,Desserts & Juices,"Soft and fluffy fruit & nut Christmas cake made with natural guilt free ingredients like whole wheat flour, jaggery syrup and loads of dry fruits. 

Allergen Information- Contains Gluten, Nutless"
Christmas Plum Muffin,75,Desserts & Juices,"A muffin-sized Plum cake made with whole wheat flour, mixed nuts, and jaggery. Enjoy this festive season guilt free!

Allergen Information- Contains Gluten, Nutless"
Hibiscus Rose Kombucha (200 Ml),171,Desserts & Juices,A delightful and tangy fermented tea infused with the floral notes of hibiscus and rose.less
Hazelnut Cold Brew Coffee (Black),142,Desserts & Juices,"A coffee infusion, cold-steeped to perfection, featuring a delightful hazelnut flavour, creating a rich and nutty refreshment.less"
Berry Basil Kombucha (200 Ml),171,Desserts & Juices,"A fermented tea infused with a blend of berries and basil, creating a refreshing and flavourful probiotic-rich beverage.less"
Tender Coconut Water,59,Desserts & Juices,"A refreshing natural tender coconut water for the day! This power-packed simple drink is full of fibre and electrolytes that switches you to a relaxing mode. Enjoy and de-stress yourself with every sip.

Allergen Information: Nuts.

""For immediate consumption""less"
Classic Cold Coffee,139,Desserts & Juices,"A perfect way to move through the day is to sip on this classic cold coffee that not only uplifts your mood but also your spirit! 

Sweetened with unrefined sugar.

Allergen information: Dairyless"
Aam Ka Panna (200ml),62,Desserts & Juices,"100% Natural aam ka panna. No added sugar, preservatives, or colour. Vegan-friendly and gluten-free. Great for immunity.less"
Mocha Shake,99,Desserts & Juices,"Enjoy this mocha shake made with milk, coffee, cocoa powder and sweetened with jaggery.

Allergen information: Dairy

""For immediate consumption""less"
Classic Masala Chaas,69,Desserts & Juices,"Grab on the low calorie buttermilk with cooling properties and refresh yourself.

Allergen information: Dairy

""For immediate consumption""less"
Lemonade,69,Desserts & Juices,"An honestly Indian traditional summer cooler loaded with Vitamin C that's refreshing and hydrating.

""For immediate consumption""less"
Ice Tea (200ml),75,Desserts & Juices,A freshly brewed chilled beverage that is strongly flavoured with lime juice and honey.less
Mixed Fruit (200ml),89,Desserts & Juices,"[Energy - 72Cal] 100% Natural fruit juice with mango, pineapple, sugarcane, pomegranate, and carrot. No added sugar, preservatives, or colour. Vegan-friendly and gluten-free.less"
Orange (200ml),107,Desserts & Juices,"[Energy - 56Cal] 100% Orange Juice. No added sugar, preservatives, or colour. Not from concentrate. Vegan-friendly and gluten-free. Great for metabolism.less"
